### ISSUE TITLE
elasticsearch.index_template_present check_definition doesn't work

### ISSUE THREAD

**Issue by PauloGDPeixoto** [saltstack/salt#49700]
I'm trying to use the elasticsearch.index_template_present check_definition state to modify the default template, so I have the following in my sls file:
```
 default_template:  
   elasticsearch.index_template_present:  
     - definition:  
         index_patterns: "*"  
         order: 0  
         settings:  
           number_of_replicas: 5  
     - check_definition: True
```

Which gives the following output:
> ----------
>           ID: default_template
>     Function: elasticsearch.index_template_present
>       Result: False
>      Comment: expected string or buffer
>      Started: 16:36:13.310927
>     Duration: 53.124 ms
>      Changes:   

Whereas running without "- check_definition: True" gives correct output, but doesn't update an existing template.

I'm running salt-ssh 2018.3.2.

**Comment by Ch3LL** [comment]
is there more information in the debug logs? i'm hoping their might be a stackstrace for this error: `expected string or buffer` that will show us on what line in the code it is failing on.

**Comment by PauloGDPeixoto** [comment]
I don't think that there is anything helpful, but I'll paste the relevant part here:

> default_template:
>   elasticsearch.index_template_present:
>     - definition:
>         index_patterns: "*"
>         order: 0
>         settings:
>           number_of_replicas: 0
>     - check_definition: True
> 
> [DEBUG   ] Results of YAML rendering: 
> OrderedDict([(u'default_template', OrderedDict([(u'elasticsearch.index_template_present', [OrderedDict([(u'definition', OrderedDict([(u'index_patterns', u'*'), (u'order', 0), (u'settings', OrderedDict([(u'number_of_replicas', 0)]))]))]), OrderedDict([(u'check_definition', True)])])]))])
> [PROFILE ] Time (in seconds) to render '/srv/jumia-pay/var/cache/salt/master/files/base/elasticsearch/init.sls' using 'yaml' renderer: 0.0211901664734
> [DEBUG   ] Could not find file 'salt://_modules' in saltenv 'base'
> [INFO    ] Caching directory '_modules/' for environment 'base'
> [DEBUG   ] Could not find file 'salt://_states' in saltenv 'base'
> [INFO    ] Caching directory '_states/' for environment 'base'
> [DEBUG   ] Could not find file 'salt://_grains' in saltenv 'base'
> [INFO    ] Caching directory '_grains/' for environment 'base'
> [DEBUG   ] Could not find file 'salt://_renderers' in saltenv 'base'
> [INFO    ] Caching directory '_renderers/' for environment 'base'
> [DEBUG   ] Could not find file 'salt://_returners' in saltenv 'base'
> [INFO    ] Caching directory '_returners/' for environment 'base'
> [DEBUG   ] Could not find file 'salt://_output' in saltenv 'base'
> [INFO    ] Caching directory '_output/' for environment 'base'
> [DEBUG   ] Could not find file 'salt://_utils' in saltenv 'base'
> [INFO    ] Caching directory '_utils/' for environment 'base'
> [DEBUG   ] Executing command: scp -o KbdInteractiveAuthentication=no -o PasswordAuthentication=no -o GSSAPIAuthentication=no -o ConnectTimeout=65 -o Port=22 -o IdentityFile=~/.ssh/id_rsa -o User=salt  /tmp/__salt.tmp.MH__4Z my-machine:/var/tmp/.salt_942df2_salt/salt_state.tgz
> [DEBUG   ] Child Forked! PID: 14955  STDOUT_FD: 12  STDERR_FD: 15
> [DEBUG   ] Terminal Command: /bin/sh -c scp -o KbdInteractiveAuthentication=no -o PasswordAuthentication=no -o GSSAPIAuthentication=no -o ConnectTimeout=65 -o Port=22 -o IdentityFile=~/.ssh/id_rsa -o User=salt  /tmp/__salt.tmp.MH__4Z my-machine:/var/tmp/.salt_942df2_salt/salt_state.tgz
> [DEBUG   ] Performing shimmed, blocking command as follows:
> state.pkg /var/tmp/.salt_942df2_salt/salt_state.tgz test=T pkg_sum=4a93405b00856601244e66f4aa030b6dab59766c47ae81e020728918a8de747d hash_type=sha256
> [DEBUG   ] Executed SHIM command. Command logged to TRACE
> [DEBUG   ] Child Forked! PID: 14959  STDOUT_FD: 12  STDERR_FD: 15
> [DEBUG   ] VT: Salt-SSH SHIM Terminal Command executed. Logged to TRACE
> [DEBUG   ] RETCODE my-machine: 0
> [DEBUG   ] LazyLoaded highstate.output

**Comment by Ch3LL** [comment]
ping @theredcat looks like you added this `check_definition` in this pr: https://github.com/saltstack/salt/pull/43573

mind taking a look here?

**Comment by theredcat** [comment]
@Ch3LL I can take a look at it.

@PauloGDPeixoto If your elastic server doesn't have a lot of traffic, could you take a network dump and try to see if it's an elastic response problem ? You can do it using this command :
`tcpdump -Ani any tcp port 9200`

**Comment by PauloGDPeixoto** [comment]
> @PauloGDPeixoto If your elastic server doesn't have a lot of traffic, could you take a network dump and try to see if it's an elastic response problem ? You can do it using this command :
> `tcpdump -Ani any tcp port 9200`
Here you go:

`13:41:04.043253 IP 127.0.0.1.44789 > 127.0.0.1.9200: Flags [S], seq 3214975890, win 43690, options [mss 65495,sackOK,TS val 5838037 ecr 0,nop,wscale 7], length 0
E..<.G@.@..r..........#..............0.........
.Y..........
13:41:04.043271 IP 127.0.0.1.9200 > 127.0.0.1.44789: Flags [S.], seq 3724072250, ack 3214975891, win 43690, options [mss 65495,sackOK,TS val 5838037 ecr 5838037,nop,wscale 7], length 0
E..<..@.@.<.........#......:.........0.........
.Y...Y......
13:41:04.043285 IP 127.0.0.1.44789 > 127.0.0.1.9200: Flags [.], ack 1, win 342, options [nop,nop,TS val 5838037 ecr 5838037], length 0
E..4.H@.@..y..........#........;...V.(.....
.Y...Y..
13:41:04.043328 IP 127.0.0.1.44789 > 127.0.0.1.9200: Flags [P.], seq 1:124, ack 1, win 342, options [nop,nop,TS val 5838037 ecr 5838037], length 123
E....I@.@.............#........;...V.......
.Y...Y..GET / HTTP/1.1
Host: 127.0.0.1:9200
Accept-Encoding: identity
connection: keep-alive
content-type: application/json


13:41:04.043333 IP 127.0.0.1.9200 > 127.0.0.1.44789: Flags [.], ack 124, win 342, options [nop,nop,TS val 5838037 ecr 5838037], length 0
E..4..@.@.z.........#......;.......V.(.....
.Y...Y..
13:41:04.044581 IP 127.0.0.1.9200 > 127.0.0.1.44789: Flags [P.], seq 1:512, ack 124, win 342, options [nop,nop,TS val 5838037 ecr 5838037], length 511
E..3..@.@.x.........#......;.......V.(.....
.Y...Y..HTTP/1.1 200 OK
content-type: application/json; charset=UTF-8
content-length: 424

{
  "name" : "hostname",
  "cluster_name" : "my_cluster",
  "cluster_uuid" : "eElyosypQM6RIQIjy44B5Q",
  "version" : {
    "number" : "6.1.2",
    "build_hash" : "5b1fea5",
    "build_date" : "2018-01-10T02:35:59.208Z",
    "build_snapshot" : false,
    "lucene_version" : "7.1.0",
    "minimum_wire_compatibility_version" : "5.6.0",
    "minimum_index_compatibility_version" : "5.0.0"
  },
  "tagline" : "You Know, for Search"
}

13:41:04.044592 IP 127.0.0.1.44789 > 127.0.0.1.9200: Flags [.], ack 512, win 350, options [nop,nop,TS val 5838037 ecr 5838037], length 0
E..4.J@.@..w..........#........:...^.(.....
.Y...Y..
13:41:04.045566 IP 127.0.0.1.44789 > 127.0.0.1.9200: Flags [P.], seq 124:274, ack 512, win 350, options [nop,nop,TS val 5838037 ecr 5838037], length 150
E....K@.@.............#........:...^.......
.Y...Y..HEAD /_template/default_template HTTP/1.1
Host: 127.0.0.1:9200
Accept-Encoding: identity
connection: keep-alive
content-type: application/json


13:41:04.046303 IP 127.0.0.1.9200 > 127.0.0.1.44789: Flags [P.], seq 512:599, ack 274, win 350, options [nop,nop,TS val 5838037 ecr 5838037], length 87
E.....@.@.zz........#......:.......^.......
.Y...Y..HTTP/1.1 200 OK
content-type: application/json; charset=UTF-8
content-length: 130


13:41:04.082467 IP 127.0.0.1.44789 > 127.0.0.1.9200: Flags [.], ack 599, win 350, options [nop,nop,TS val 5838047 ecr 5838037], length 0
E..4.L@.@..u..........#............^.(.....
.Y...Y..
13:41:04.110909 IP 127.0.0.1.44789 > 127.0.0.1.9200: Flags [F.], seq 274, ack 599, win 350, options [nop,nop,TS val 5838054 ecr 5838037], length 0
E..4.M@.@..t..........#............^.(.....
.Y...Y..
13:41:04.111160 IP 127.0.0.1.9200 > 127.0.0.1.44789: Flags [F.], seq 599, ack 275, win 350, options [nop,nop,TS val 5838054 ecr 5838054], length 0
E..4..@.@.z.........#..............^.(.....
.Y...Y..
13:41:04.111172 IP 127.0.0.1.44789 > 127.0.0.1.9200: Flags [.], ack 600, win 350, options [nop,nop,TS val 5838054 ecr 5838054], length 0
E..4.N@.@..s..........#............^.(.....
.Y...Y..`
